Sheet: Sheet1
A1: App->Lights | B1: Data table | C1: AAFFSSDD
C2: Function | D2: F=2char<hex> | E2: Speed | F2: S=2char<hex> | H2: D=44 | I2: Value | J2: Hex | L2: Deecimal
C3: 1 | D3: 25 | E3: 0 | F3: 34 | G3: 0=36 | I3: Speed 0-100 | J3: S value 01-36
C4: 2 | D4: 26 | E4: 10 | G4: 2=34 | I4: 100 | J4: 1 | K4: of:=[.I4]-100 -> 0 | L4: of:=DECIMAL([.J4];16) -> 1
C5: 3 | D5: 27 | E5: 20 | G5: 4=33 | I5: 98 | J5: 2 | L5: of:=DECIMAL([.J5];16) -> 2
C6: 4 | D6: 28 | E6: 30 | G6: 6=32 | I6: 96 | J6: 3 | L6: of:=DECIMAL([.J6];16) -> 3
C7: 5 | D7: 29 | E7: 40 | G7: 8=31 | I7: 94 | J7: 4 | L7: of:=DECIMAL([.J7];16) -> 4
C8: 6 | D8: 2a | E8: 50 | G8: 10=30h | I8: 92 | J8: 5 | L8: of:=DECIMAL([.J8];16) -> 5
C9: 7 | D9: 2b | E9: 60 | G9: 100=01 | I9: 90 | J9: 6 | L9: of:=DECIMAL([.J9];16) -> 6
C10: 8 | D10: 2c | E10: 70 | G10: 98=02 | I10: 88 | J10: 7 | L10: of:=DECIMAL([.J10];16) -> 7
C11: 9 | D11: 2d | E11: 80 | F11: 0b | G11: 96=03 | I11: 86 | J11: 8 | L11: of:=DECIMAL([.J11];16) -> 8
C12: 10 | D12: 2e | E12: 90 | F12: 06 | G12: 94=04 | I12: 84 | J12: 9 | L12: of:=DECIMAL([.J12];16) -> 9
C13: 11 | D13: 2f | E13: 100 | F13: 01 | I13: 82 | J13: a | L13: of:=DECIMAL([.J13];16) -> 10
C14: 12 | D14: 30 | I14: 80 | J14: b | L14: of:=DECIMAL([.J14];16) -> 11
C15: 13 | D15: 31 | I15: 78 | J15: c | L15: of:=DECIMAL([.J15];16) -> 12
C16: 14 | D16: 32 | I16: 76 | J16: d | L16: of:=DECIMAL([.J16];16) -> 13
C17: 15 | D17: 33 | I17: 74 | J17: e | L17: of:=DECIMAL([.J17];16) -> 14
C18: 16 | D18: 34 | I18: 72 | J18: f | L18: of:=DECIMAL([.J18];16) -> 15
C19: 17 | D19: 35 | I19: 70 | J19: 10 | L19: of:=DECIMAL([.J19];16) -> 16
C20: 18 | D20: 36 | I20: 68 | J20: 11 | L20: of:=DECIMAL([.J20];16) -> 17
C21: 19 | D21: 37 | I21: 66 | J21: 13 | K21: 67=12 | L21: of:=DECIMAL([.J21];16) -> 19
C22: 20 | D22: 38 | I22: 64 | J22: 14 | L22: of:=DECIMAL([.J22];16) -> 20
C23: 21 | D23: 39 | I23: 62 | J23: 15 | L23: of:=DECIMAL([.J23];16) -> 21
I24: 60 | J24: 16 | L24: of:=DECIMAL([.J24];16) -> 22
I25: 58 | J25: 17 | L25: of:=DECIMAL([.J25];16) -> 23
C26: App->Lights | D26: Lights->App | I26: 56 | J26: 18 | L26: of:=DECIMAL([.J26];16) -> 24
B27: Turn on | C27: cc2333 | D27: ee2311 | I27: 54 | J27: 19 | L27: of:=DECIMAL([.J27];16) -> 25
B28: Ask status | C28: ef0177 | D28: 66:f1:23:33:21:1b:00:00:00:10:07:06:99 while-on | I28: 52 | J28: 1a | L28: of:=DECIMAL([.J28];16) -> 26
B29: Turn off | C29: cc2433 | D29: ee2411 | I29: 50 | J29: 1b | L29: of:=DECIMAL([.J29];16) -> 27
B30: Ask status | C30: ef0177 | D30: 66:f1:24:33:21:1b:00:00:00:aa:07:06:99 while-off | I30: 48 | J30: 1c | L30: of:=DECIMAL([.J30];16) -> 28
D31: 6byte color data on custm colors | I31: 46 | J31: 1d | L31: of:=DECIMAL([.J31];16) -> 29
D32: 560014ff00aa | E32: 100%bright | I32: 44 | J32: 1e | L32: of:=DECIMAL([.J32];16) -> 30
D33: 5600000000aa | E33: 0% bright | I33: 42 | J33: 1f | L33: of:=DECIMAL([.J33];16) -> 31
D34: 56000a8000aa | E34: 50%bright | I34: 40 | J34: 20 | L34: of:=DECIMAL([.J34];16) -> 32
D35: 5600044000aa | E35: 25%bright | I35: 38 | J35: 21 | L35: of:=DECIMAL([.J35];16) -> 33
D36: 56000ec000aa | E36: 75%bright | I36: 36 | J36: 22 | L36: of:=DECIMAL([.J36];16) -> 34
I37: 34 | J37: 23 | K37: 33=24 | L37: of:=DECIMAL([.J37];16) -> 35
I38: 32 | J38: 25 | L38: of:=DECIMAL([.J38];16) -> 37
I39: 30 | J39: 26 | L39: of:=DECIMAL([.J39];16) -> 38
I40: 28 | J40: 27 | L40: of:=DECIMAL([.J40];16) -> 39
I41: 26 | J41: 28 | L41: of:=DECIMAL([.J41];16) -> 40
I42: 24 | J42: 29 | L42: of:=DECIMAL([.J42];16) -> 41
I43: 22 | J43: 2a | L43: of:=DECIMAL([.J43];16) -> 42
I44: 20 | J44: 2b | L44: of:=DECIMAL([.J44];16) -> 43
I45: 18 | J45: 2c | L45: of:=DECIMAL([.J45];16) -> 44
I46: 16 | J46: 2d | L46: of:=DECIMAL([.J46];16) -> 45
I47: 14 | J47: 2e | L47: of:=DECIMAL([.J47];16) -> 46
I48: 12 | J48: 2f | L48: of:=DECIMAL([.J48];16) -> 47
I49: 10 | J49: 30 | L49: of:=DECIMAL([.J49];16) -> 48
I50: 8 | J50: 31 | L50: of:=DECIMAL([.J50];16) -> 49
I51: 6 | J51: 32 | L51: of:=DECIMAL([.J51];16) -> 50
I52: 4 | J52: 33 | L52: of:=DECIMAL([.J52];16) -> 51
I53: 2 | J53: 34 | K53: 1=35 | L53: of:=DECIMAL([.J53];16) -> 52
I54: 0 | J54: 36 | L54: of:=DECIMAL([.J54];16) -> 54